{
  "ok": false,
  "schemaVersion": "omk.contract.v1",
  "command": "proof:check:006-evidence-block",
  "omkVersion": "1.2.0-rc.0",
  "runtimeVersion": "v1.2",
  "commit": "83cb8bdf5de1",
  "runId": "proof-006-evidence-block-20260531t080818z",
  "traceId": "006-evidence-block",
  "status": "blocked",
  "data": {
    "scenario": "evidence-block",
    "claim": "OMK verify does not accept a run when a required file-exists evidence gate is missing.",
    "observedVerify": {
      "ok": false,
      "exitCode": 1,
      "failed": 1,
      "missing": 0,
      "errors": [
        "required-artifact: file-exists ([repo-root]/proof/verified-runs/006-evidence-block/required-output.txt) — File does not exist: [repo-root]/proof/verified-runs/006-evidence-block/required-output.txt"
      ]
    },
    "artifacts": [
      {
        "path": "proof/verified-runs/006-evidence-block/omk-verify.json",
        "kind": "verify-output"
      },
      {
        "path": "proof/verified-runs/006-evidence-block/omk-verify.stderr",
        "kind": "stderr"
      },
      {
        "path": "proof/verified-runs/006-evidence-block/state.json",
        "kind": "run-state"
      }
    ]
  },
  "warnings": [],
  "errors": [
    {
      "code": "EVIDENCE_MISSING",
      "message": "Required evidence file was missing and completion was blocked.",
      "recoverable": true,
      "severity": "error",
      "hint": "Create the required artifact or re-run the node before accepting dependents.",
      "path": "proof/verified-runs/006-evidence-block/required-output.txt"
    }
  ],
  "evidenceRefs": [
    "proof/verified-runs/006-evidence-block/evidence.jsonl"
  ],
  "decisionRefs": [
    "proof/verified-runs/006-evidence-block/decisions.jsonl"
  ],
  "metadata": {
    "cwd": "[repo-root]",
    "platform": "linux",
    "nodeVersion": "v22.22.3",
    "durationMs": 107,
    "timestamp": "2026-05-31T08:08:18Z"
  }
}
