{
  "ok": true,
  "schemaVersion": "omk.contract.v1",
  "command": "proof:check:008-graph-audit",
  "omkVersion": "1.2.0-rc.0",
  "runtimeVersion": "v1.2",
  "commit": "83cb8bdf5de1",
  "runId": "proof-008-graph-audit-20260531t080818z",
  "traceId": "008-graph-audit",
  "status": "passed",
  "data": {
    "scenario": "graph-audit",
    "claim": "Graph audit links run, evidence, decision, and provider route nodes through audit edges.",
    "graphAudit": {
      "exitCode": 0,
      "ok": true,
      "checks": [
        {
          "id": "run-node-linked",
          "passed": true,
          "expected": 1,
          "observed": 1,
          "missing": []
        },
        {
          "id": "evidence-nodes-linked",
          "passed": true,
          "expected": 1,
          "observed": 1,
          "missing": []
        },
        {
          "id": "decision-nodes-linked",
          "passed": true,
          "expected": 1,
          "observed": 1,
          "missing": []
        },
        {
          "id": "provider-route-visible",
          "passed": true,
          "expected": 1,
          "observed": 1,
          "missing": []
        },
        {
          "id": "audit-edges-linked",
          "passed": true,
          "expected": 2,
          "observed": 3,
          "missing": []
        }
      ]
    },
    "graphView": {
      "exitCode": 0,
      "output": "proof/verified-runs/008-graph-audit/graph-view.html"
    },
    "artifacts": [
      {
        "path": "proof/verified-runs/008-graph-audit/graph-audit.json",
        "kind": "graph-audit-output"
      },
      {
        "path": "proof/verified-runs/008-graph-audit/graph-view.html",
        "kind": "graph-view"
      },
      {
        "path": "proof/verified-runs/008-graph-audit/graph-state.json",
        "kind": "graph-state"
      }
    ]
  },
  "warnings": [],
  "errors": [],
  "evidenceRefs": [
    "proof/verified-runs/008-graph-audit/evidence.jsonl"
  ],
  "decisionRefs": [
    "proof/verified-runs/008-graph-audit/decisions.jsonl"
  ],
  "metadata": {
    "cwd": "[repo-root]",
    "platform": "linux",
    "nodeVersion": "v22.22.3",
    "durationMs": 141,
    "timestamp": "2026-05-31T08:08:18Z"
  }
}
