{
  "ok": true,
  "schemaVersion": "omk.contract.v1",
  "command": "proof:check:004-native-safety",
  "omkVersion": "1.2.0-rc.0",
  "runtimeVersion": "v1.2",
  "commit": "edb00974291d",
  "runId": "proof-004-native-safety-20260531t063440z",
  "traceId": "proof-004-native-safety",
  "status": "passed",
  "data": {
    "scenario": "native-safety",
    "claim": "Native no-Kimi turn safety test completed successfully.",
    "commandCount": 1,
    "evidenceSummary": {
      "required": 1,
      "passed": 1,
      "failed": 0,
      "missing": 0
    },
    "artifacts": [
      {
        "path": "proof/verified-runs/004-native-safety/command-1.out",
        "kind": "stdout"
      }
    ]
  },
  "warnings": [],
  "errors": [],
  "evidenceRefs": [
    "proof/verified-runs/004-native-safety/evidence.jsonl"
  ],
  "decisionRefs": [
    "proof/verified-runs/004-native-safety/decisions.jsonl"
  ],
  "metadata": {
    "cwd": "[repo-root]",
    "platform": "linux",
    "nodeVersion": "v22.22.3",
    "durationMs": 654,
    "timestamp": "2026-05-31T06:34:40Z"
  }
}
