{
  "ok": true,
  "schemaVersion": "omk.contract.v1",
  "command": "proof:check:005-contract-version-smoke",
  "omkVersion": "1.2.0-rc.0",
  "runtimeVersion": "v1.2",
  "commit": "edb00974291d",
  "runId": "proof-005-contract-version-smoke-20260531t063440z",
  "traceId": "proof-005-contract-version-smoke",
  "status": "passed",
  "data": {
    "scenario": "contract-version-smoke",
    "claim": "Contract and version hardening gates completed successfully.",
    "commandCount": 2,
    "evidenceSummary": {
      "required": 2,
      "passed": 2,
      "failed": 0,
      "missing": 0
    },
    "artifacts": [
      {
        "path": "proof/verified-runs/005-contract-version-smoke/command-1.out",
        "kind": "stdout"
      },
      {
        "path": "proof/verified-runs/005-contract-version-smoke/command-2.out",
        "kind": "stdout"
      }
    ]
  },
  "warnings": [],
  "errors": [],
  "evidenceRefs": [
    "proof/verified-runs/005-contract-version-smoke/evidence.jsonl"
  ],
  "decisionRefs": [
    "proof/verified-runs/005-contract-version-smoke/decisions.jsonl"
  ],
  "metadata": {
    "cwd": "[repo-root]",
    "platform": "linux",
    "nodeVersion": "v22.22.3",
    "durationMs": 7361,
    "timestamp": "2026-05-31T06:34:48Z"
  }
}
