{
  "ok": true,
  "schemaVersion": "omk.contract.v1",
  "command": "proof:check:003-fallback-route",
  "omkVersion": "1.2.0-rc.0",
  "runtimeVersion": "v1.2",
  "commit": "edb00974291d",
  "runId": "proof-003-fallback-route-20260531t063434z",
  "traceId": "proof-003-fallback-route",
  "status": "passed",
  "data": {
    "scenario": "fallback-route",
    "claim": "Auto route smoke completed with Kimi unavailable, exercising provider fallback routing.",
    "commandCount": 1,
    "evidenceSummary": {
      "required": 1,
      "passed": 1,
      "failed": 0,
      "missing": 0
    },
    "artifacts": [
      {
        "path": "proof/verified-runs/003-fallback-route/command-1.out",
        "kind": "stdout"
      }
    ]
  },
  "warnings": [],
  "errors": [],
  "evidenceRefs": [
    "proof/verified-runs/003-fallback-route/evidence.jsonl"
  ],
  "decisionRefs": [
    "proof/verified-runs/003-fallback-route/decisions.jsonl"
  ],
  "metadata": {
    "cwd": "[repo-root]",
    "platform": "linux",
    "nodeVersion": "v22.22.3",
    "durationMs": 5596,
    "timestamp": "2026-05-31T06:34:40Z"
  }
}
