{
  "ok": true,
  "schemaVersion": "omk.contract.v1",
  "command": "proof:check:001-no-kimi-codex-smoke",
  "omkVersion": "1.2.0-rc.0",
  "runtimeVersion": "v1.2",
  "commit": "cd3a51f860d2",
  "runId": "chat-2026-05-31T05-20-57-565Z-3602298",
  "traceId": "proof-001-no-kimi-codex-smoke",
  "status": "passed",
  "data": {
    "scenario": "no-kimi-smoke",
    "provider": "codex",
    "evidenceSummary": {
      "required": 3,
      "passed": 3,
      "failed": 0,
      "missing": 0
    },
    "artifacts": [
      {
        "path": "proof/verified-runs/001-no-kimi-codex-smoke/build-clean.out",
        "kind": "stdout"
      },
      {
        "path": "proof/verified-runs/001-no-kimi-codex-smoke/smoke-no-kimi-codex.out",
        "kind": "stdout"
      }
    ]
  },
  "warnings": [],
  "errors": [],
  "evidenceRefs": [
    "proof/verified-runs/001-no-kimi-codex-smoke/evidence.jsonl"
  ],
  "decisionRefs": [
    "proof/verified-runs/001-no-kimi-codex-smoke/decisions.jsonl"
  ],
  "metadata": {
    "cwd": "[repo-root]",
    "platform": "linux",
    "nodeVersion": "v22.22.3",
    "durationMs": 12013,
    "timestamp": "2026-05-31T05:21:03.236Z"
  }
}
