{
  "ok": true,
  "schemaVersion": "omk.contract.v1",
  "command": "proof:check:002-doctor-provider",
  "omkVersion": "1.2.0-rc.0",
  "runtimeVersion": "v1.2",
  "commit": "edb00974291d",
  "runId": "proof-002-doctor-provider-20260531t063424z",
  "traceId": "proof-002-doctor-provider",
  "status": "passed",
  "data": {
    "scenario": "doctor-provider",
    "claim": "Doctor JSON smoke completed under no-Kimi conditions.",
    "commandCount": 1,
    "evidenceSummary": {
      "required": 1,
      "passed": 1,
      "failed": 0,
      "missing": 0
    },
    "artifacts": [
      {
        "path": "proof/verified-runs/002-doctor-provider/command-1.out",
        "kind": "stdout"
      }
    ]
  },
  "warnings": [],
  "errors": [],
  "evidenceRefs": [
    "proof/verified-runs/002-doctor-provider/evidence.jsonl"
  ],
  "decisionRefs": [
    "proof/verified-runs/002-doctor-provider/decisions.jsonl"
  ],
  "metadata": {
    "cwd": "[repo-root]",
    "platform": "linux",
    "nodeVersion": "v22.22.3",
    "durationMs": 9534,
    "timestamp": "2026-05-31T06:34:34Z"
  }
}
