{
  "ok": true,
  "schemaVersion": "omk.contract.v1",
  "command": "proof:check:010-fallback-routing",
  "omkVersion": "1.2.0-rc.0",
  "runtimeVersion": "v1.2",
  "commit": "cf5b8083a7e3",
  "runId": "proof-010-fallback-routing-20260531t090157359z",
  "traceId": "proof-010-fallback-routing",
  "status": "passed",
  "data": {
    "scenario": "fallback-route",
    "providerBefore": "deepseek",
    "providerAfter": "kimi",
    "evidenceSummary": {
      "required": 2,
      "passed": 2,
      "failed": 0,
      "missing": 0
    },
    "artifacts": [
      {
        "kind": "stdout",
        "path": "proof/verified-runs/010-fallback-routing/fallback-routing-test.out"
      },
      {
        "kind": "stderr",
        "path": "proof/verified-runs/010-fallback-routing/fallback-routing-test.stderr"
      }
    ]
  },
  "warnings": [],
  "errors": [],
  "evidenceRefs": [
    {
      "schemaVersion": "omk.evidence.v1",
      "evidenceId": "fallback-routing-test-exit",
      "runId": "proof-010-fallback-routing-20260531t090157359z",
      "path": "proof/verified-runs/010-fallback-routing/evidence.jsonl"
    },
    {
      "schemaVersion": "omk.evidence.v1",
      "evidenceId": "provider-fallback-metadata",
      "runId": "proof-010-fallback-routing-20260531t090157359z",
      "path": "proof/verified-runs/010-fallback-routing/evidence.jsonl"
    }
  ],
  "decisionRefs": [
    {
      "schemaVersion": "omk.decision.v1",
      "decisionId": "010-provider-fallback-routing",
      "runId": "proof-010-fallback-routing-20260531t090157359z",
      "path": "proof/verified-runs/010-fallback-routing/decisions.jsonl"
    },
    {
      "schemaVersion": "omk.decision.v1",
      "decisionId": "010-evidence-verdict",
      "runId": "proof-010-fallback-routing-20260531t090157359z",
      "path": "proof/verified-runs/010-fallback-routing/decisions.jsonl"
    }
  ],
  "metadata": {
    "cwd": "[repo-root]",
    "platform": "linux",
    "nodeVersion": "v22.22.3",
    "durationMs": 0,
    "timestamp": "2026-05-31T09:01:57.618Z"
  }
}
