{
  "ok": true,
  "schemaVersion": "omk.contract.v1",
  "command": "proof:check:009-no-kimi-smoke",
  "omkVersion": "1.2.0-rc.0",
  "runtimeVersion": "v1.2",
  "commit": "cf5b8083a7e3",
  "runId": "proof-009-no-kimi-smoke-20260531t090138424z",
  "traceId": "proof-009-no-kimi-smoke",
  "status": "passed",
  "data": {
    "scenario": "no-kimi-smoke",
    "kimiUnavailable": true,
    "providerNeutralPath": true,
    "evidenceSummary": {
      "required": 2,
      "passed": 2,
      "failed": 0,
      "missing": 0
    },
    "artifacts": [
      {
        "kind": "stdout",
        "path": "proof/verified-runs/009-no-kimi-smoke/verify-no-kimi.out"
      },
      {
        "kind": "stderr",
        "path": "proof/verified-runs/009-no-kimi-smoke/verify-no-kimi.stderr"
      }
    ]
  },
  "warnings": [],
  "errors": [],
  "evidenceRefs": [
    {
      "schemaVersion": "omk.evidence.v1",
      "evidenceId": "verify-no-kimi-exit",
      "runId": "proof-009-no-kimi-smoke-20260531t090138424z",
      "path": "proof/verified-runs/009-no-kimi-smoke/evidence.jsonl"
    },
    {
      "schemaVersion": "omk.evidence.v1",
      "evidenceId": "kimi-unavailable-nonfatal",
      "runId": "proof-009-no-kimi-smoke-20260531t090138424z",
      "path": "proof/verified-runs/009-no-kimi-smoke/evidence.jsonl"
    }
  ],
  "decisionRefs": [
    {
      "schemaVersion": "omk.decision.v1",
      "decisionId": "009-provider-neutral-route",
      "runId": "proof-009-no-kimi-smoke-20260531t090138424z",
      "path": "proof/verified-runs/009-no-kimi-smoke/decisions.jsonl"
    },
    {
      "schemaVersion": "omk.decision.v1",
      "decisionId": "009-evidence-verdict",
      "runId": "proof-009-no-kimi-smoke-20260531t090138424z",
      "path": "proof/verified-runs/009-no-kimi-smoke/decisions.jsonl"
    }
  ],
  "metadata": {
    "cwd": "[repo-root]",
    "platform": "linux",
    "nodeVersion": "v22.22.3",
    "durationMs": 0,
    "timestamp": "2026-05-31T09:01:57.356Z"
  }
}
