{
  "ok": true,
  "schemaVersion": "omk.contract.v1",
  "command": "proof:check:007-replay-inspect",
  "omkVersion": "1.2.0-rc.0",
  "runtimeVersion": "v1.2",
  "commit": "83cb8bdf5de1",
  "runId": "proof-007-replay-inspect-20260531t080818z",
  "traceId": "007-replay-inspect",
  "status": "passed",
  "data": {
    "scenario": "replay-inspect",
    "claim": "Replay and inspect can reopen a run fixture and expose linked evidence plus decision traces.",
    "replay": {
      "exitCode": 0,
      "runId": "proof-007-replay-inspect-20260531t080818z",
      "timelineEvents": 6
    },
    "inspect": {
      "exitCode": 0,
      "runId": "proof-007-replay-inspect-20260531t080818z",
      "evidence": 1,
      "decisions": 1
    },
    "artifacts": [
      {
        "path": "proof/verified-runs/007-replay-inspect/replay.json",
        "kind": "replay-output"
      },
      {
        "path": "proof/verified-runs/007-replay-inspect/inspect.json",
        "kind": "inspect-output"
      },
      {
        "path": "proof/verified-runs/007-replay-inspect/run-fixture/run.json",
        "kind": "fixture"
      },
      {
        "path": "proof/verified-runs/007-replay-inspect/run-fixture/attempts.jsonl",
        "kind": "fixture"
      }
    ]
  },
  "warnings": [],
  "errors": [],
  "evidenceRefs": [
    "proof/verified-runs/007-replay-inspect/evidence.jsonl"
  ],
  "decisionRefs": [
    "proof/verified-runs/007-replay-inspect/decisions.jsonl"
  ],
  "metadata": {
    "cwd": "[repo-root]",
    "platform": "linux",
    "nodeVersion": "v22.22.3",
    "durationMs": 232,
    "timestamp": "2026-05-31T08:08:18Z"
  }
}
